[
  {
    "source_id": "KING_DRUM",
    "speaker": "Martin Luther King Jr.",
    "role": "Minister and civil rights leader",
    "event": "*The Drum Major Instinct*, Feb. 4, 1968; Jesus and greatness through service",
    "event_date": "1968-02-04",
    "date_status": "verified",
    "original_producer": null,
    "source_url": "https://kinginstitute.stanford.edu/drum-major-instinct",
    "original_master_url": null,
    "verification_status": "source_confirmed",
    "width": null,
    "height": null,
    "fps": null,
    "duration_ms": null,
    "research_urls": [
      "https://kinginstitute.stanford.edu/drum-major-instinct"
    ],
    "research_notes": "Stanford confirms the sermon date and service theme. Its notice directs licensing to IPM for the King Estate. No recording or source timecodes reviewed.",
    "accessed_date": "2026-10-09"
  },
  {
    "source_id": "REAGAN_XMAS",
    "speaker": "Ronald Reagan",
    "role": "U.S. president, 1981–1989",
    "event": "Christmas radio address, Dec. 24, 1983; Jesus beyond moral teacher",
    "event_date": "1983-12-24",
    "date_status": "verified",
    "original_producer": "White House Television Office (catalogue lead)",
    "source_url": "https://www.reaganlibrary.gov/archives/speech/radio-address-nation-christmas",
    "original_master_url": "https://www.youtube.com/watch?v=GT6xEAGA_nE",
    "verification_status": "source_confirmed",
    "width": null,
    "height": null,
    "fps": null,
    "duration_ms": null,
    "research_urls": [
      "https://www.reaganlibrary.gov/archives/speech/radio-address-nation-christmas"
    ],
    "research_notes": "Official transcript confirms the Christmas address. A Reagan Library upload identifies NARA 74614571 and reports unrestricted use. Confirm the exact master and embedded material before clearance.",
    "accessed_date": "2026-10-09"
  },
  {
    "source_id": "JFK_TREE",
    "speaker": "John F. Kennedy",
    "role": "U.S. president, 1961–1963",
    "event": "National Christmas Tree remarks, Dec. 17, 1962",
    "event_date": "1962-12-17",
    "date_status": "lead_only",
    "original_producer": null,
    "source_url": "https://www.jfklibrary.org/asset-viewer/archives/jfkwha-155-008",
    "original_master_url": null,
    "verification_status": "unverified",
    "width": null,
    "height": null,
    "fps": null,
    "duration_ms": null,
    "research_urls": [],
    "research_notes": "User-provided research lead; not independently checked.",
    "accessed_date": null
  },
  {
    "source_id": "BUSH_DEBATE",
    "speaker": "George W. Bush",
    "role": "Presidential candidate at recording",
    "event": "1999 debate response: Christ changed his heart",
    "event_date": null,
    "date_status": "lead_only",
    "original_producer": null,
    "source_url": "https://www.c-span.org/clip/public-affairs-event/user-clip-george-w-bush-on-why-he-admires-christ/4528159",
    "original_master_url": null,
    "verification_status": "unverified",
    "width": null,
    "height": null,
    "fps": null,
    "duration_ms": null,
    "research_urls": [],
    "research_notes": "User-provided research lead; not independently checked.",
    "accessed_date": null
  },
  {
    "source_id": "ELIZABETH_XMAS",
    "speaker": "Elizabeth II",
    "role": "Queen at recording",
    "event": "2011 Christmas broadcast; Jesus and forgiveness",
    "event_date": null,
    "date_status": "lead_only",
    "original_producer": null,
    "source_url": "https://www.royal.uk/christmas-broadcast-2011",
    "original_master_url": null,
    "verification_status": "unverified",
    "width": null,
    "height": null,
    "fps": null,
    "duration_ms": null,
    "research_urls": [],
    "research_notes": "User-provided research lead; not independently checked.",
    "accessed_date": null
  },
  {
    "source_id": "OBAMA_EASTER",
    "speaker": "Barack Obama",
    "role": "U.S. president at recording",
    "event": "Easter Prayer Breakfast, Apr. 7, 2015; Jesus' humility",
    "event_date": "2015-04-07",
    "date_status": "lead_only",
    "original_producer": null,
    "source_url": "https://obamawhitehouse.archives.gov/the-press-office/2015/04/07/remarks-president-and-vice-president-easter-prayer-breakfast",
    "original_master_url": null,
    "verification_status": "unverified",
    "width": null,
    "height": null,
    "fps": null,
    "duration_ms": null,
    "research_urls": [],
    "research_notes": "User-provided research lead; not independently checked.",
    "accessed_date": null
  },
  {
    "source_id": "MANDELA_EASTER",
    "speaker": "Nelson Mandela",
    "role": "Political leader",
    "event": "Zion Christian Church Easter conference, Apr. 1994",
    "event_date": "1994-04-03",
    "date_status": "lead_only",
    "original_producer": null,
    "source_url": "https://sahistory.org.za/archive/speech-nelson-mandela-zionist-christian-church-easter-conference-moria-3-april-1994",
    "original_master_url": null,
    "verification_status": "unverified",
    "width": null,
    "height": null,
    "fps": null,
    "duration_ms": null,
    "research_urls": [],
    "research_notes": "User-provided research lead; not independently checked.",
    "accessed_date": null
  },
  {
    "source_id": "COLLINS_TESTIMONY",
    "speaker": "Francis Collins",
    "role": "Physician and geneticist",
    "event": "BioLogos, *A Testimony*",
    "event_date": null,
    "date_status": "lead_only",
    "original_producer": "BioLogos",
    "source_url": "https://biologos.org/insights/videos/francis-collins-a-testimony",
    "original_master_url": null,
    "verification_status": "source_confirmed",
    "width": null,
    "height": null,
    "fps": null,
    "duration_ms": null,
    "research_urls": [
      "https://biologos.org/insights/videos/francis-collins-a-testimony"
    ],
    "research_notes": "Producer page describes a conversion account and identifies the Insights series as BioLogos. Recording date, verbatim speech and media timecodes are not verified.",
    "accessed_date": "2026-10-09"
  },
  {
    "source_id": "LENNOX_RESURRECTION",
    "speaker": "John Lennox",
    "role": "Mathematician",
    "event": "*Can a Scientist Believe in the Resurrection?*",
    "event_date": null,
    "date_status": "lead_only",
    "original_producer": null,
    "source_url": "https://www.youtube.com/watch?v=0jAlsaj16KQ",
    "original_master_url": null,
    "verification_status": "unverified",
    "width": null,
    "height": null,
    "fps": null,
    "duration_ms": null,
    "research_urls": [],
    "research_notes": "User-provided research lead; not independently checked.",
    "accessed_date": null
  },
  {
    "source_id": "BONO_MEANING",
    "speaker": "Bono",
    "role": "Musician",
    "event": "RTÉ interview with Gay Byrne, 2013; Jesus' divinity",
    "event_date": null,
    "date_status": "lead_only",
    "original_producer": "RTÉ",
    "source_url": "https://www.youtube.com/watch?v=OZnsgvmTJmo",
    "original_master_url": null,
    "verification_status": "source_confirmed",
    "width": null,
    "height": null,
    "fps": null,
    "duration_ms": null,
    "research_urls": [
      "https://www.rte.ie/entertainment/2013/0618/457284-nothing-off-limits-in-bono-interview-gay-byrne/"
    ],
    "research_notes": "RTÉ announcement confirms the interview and scheduled 25 June 2013 broadcast. Exact Jesus passage remains unverified. Search-index evidence was available; direct page retrieval failed.",
    "accessed_date": "2026-10-09"
  },
  {
    "source_id": "CARREY_HOMEBOY",
    "speaker": "Jim Carrey",
    "role": "Actor and comedian",
    "event": "Homeboy Industries, 2017; Jesus and forgiveness",
    "event_date": null,
    "date_status": "lead_only",
    "original_producer": null,
    "source_url": "https://www.youtube.com/watch?v=MzyaQ0H5D74",
    "original_master_url": null,
    "verification_status": "unverified",
    "width": null,
    "height": null,
    "fps": null,
    "duration_ms": null,
    "research_urls": [
      "https://homeboyindustries.org/news-events/media-resource/"
    ],
    "research_notes": "Official media page provides an acquisition contact. It does not verify the proposed 2017 speech. The supplied YouTube lead could not be retrieved. Do not infer a conversion.",
    "accessed_date": "2026-10-09"
  },
  {
    "source_id": "DENZEL_BERNARD",
    "speaker": "Denzel Washington",
    "role": "Actor",
    "event": "Conversation with A. R. Bernard, June 2020",
    "event_date": null,
    "date_status": "lead_only",
    "original_producer": null,
    "source_url": "https://www.instagram.com/reel/CB1GzGkDLb3/",
    "original_master_url": null,
    "verification_status": "unverified",
    "width": null,
    "height": null,
    "fps": null,
    "duration_ms": null,
    "research_urls": [],
    "research_notes": "User-provided research lead; not independently checked.",
    "accessed_date": null
  },
  {
    "source_id": "CURRY_MVP",
    "speaker": "Stephen Curry",
    "role": "Basketball player",
    "event": "NBA MVP speech, 2015",
    "event_date": null,
    "date_status": "lead_only",
    "original_producer": null,
    "source_url": "https://www.youtube.com/watch?v=fvJl02AziO0",
    "original_master_url": null,
    "verification_status": "unverified",
    "width": null,
    "height": null,
    "fps": null,
    "duration_ms": null,
    "research_urls": [],
    "research_notes": "User-provided research lead; not independently checked.",
    "accessed_date": null
  },
  {
    "source_id": "SCHEFFLER_MASTERS",
    "speaker": "Scottie Scheffler",
    "role": "Professional golfer",
    "event": "Masters press conference, Apr. 9, 2024; identity in Jesus",
    "event_date": "2024-04-09",
    "date_status": "verified",
    "original_producer": null,
    "source_url": "https://asaptext.com/asap_media/media/1079/1207/transcripts/143176.pdf",
    "original_master_url": null,
    "verification_status": "source_confirmed",
    "width": null,
    "height": null,